Filename,Transcribed Text
cccidaho27.jpg,includes the text: LEAVING STATE PARK oo SS nae so an
cccidaho712.jpg,includes the text: act ER cAMP Peas fee Be ay ay doe or Bend
kooskia786.jpg,includes the text: of Justice Internment Camp Reservation Be official No Admission
kooskia900.jpg,includes the text: GLADE CREEK
ug138_1_1_035.jpg,includes the text: of Entomology and Plant Quarantine Subject Office Locality wo Date Size Photographer ne Lo Release Hold Published Plate Page Description Ma Bind at AH drape let Oo wanna en as La an wanna SS GOVERNMENT PRINTING OFFICE OVER
