Filename,Transcribed Text
69_2_I-14.jpg,includes the text: WHEEL ENGINE DATA WHEEL DATA DIAMETER STROKE FACE WEIGHT THE BIG WHEEL WAS MANUFACTURED AND MOVED THE FIDELITY LUMBER WAS SERVICE OVER BILLION BOARD FEET THE ENGINE WAS DONATED THE THE DIAMOND NATIONAL PRESERVE PART AND THE ENGINE THIS AND PRESENTED THE CITY
69_2_I-16.jpg,includes the text: eat ore roe sate CARRY Hay THE AMPLY half lows Aged ate
cccidaho1134.jpg,includes the text: one
cccidaho1968.jpg,includes the text: FOREST SERVICE
cccidaho21.jpg,includes the text: PICNICKING CAMP
cccidaho27.jpg,includes the text: LEAVING STATE PARK nae
cccidaho712.jpg,includes the text: act cAMP Peas fee doe Bend
cccidaho725.jpg,includes the text: Bee
kooskia786.jpg,includes the text: Justice Internment Camp Reservation official Admission
kooskia887.jpg,includes the text: ire mow ear Pee
kooskia900.jpg,includes the text: GLADE CREEK
ott950.jpg,No text detected
pg21370.jpg,includes the text: WELCOME Ever bey ane
pg83-b01-f04-032_001.jpg,includes the text: ROOK CORES GETS
phs377.jpg,includes the text: OWNED LAND continuous forests crop TREE omits fie dean fee vans mara omit bee Rose haw Ramen pace twat town rove omer ton firemen tore See does men ere fears Lows Ram tee Lames Capon braces Yous Went vat Cent ERE PES
phs429.jpg,includes the text: Accidents Don't Just Happen THEY ARE CAUSED
psychiana716.jpg,includes the text: FOR RENT Cross
ug135-scrapbook1-page10.jpg,includes the text: August Said Very Indeed four lure operation where Pap students into practice rural senior medical students are completing fat Was described here their residency requirements Other very impressive residencies will arranged Bore mut ane the Bureau obstetrics and and Manpower locations various ate observing the stares deep national concern they tale program over the geographical distribution medical education administered the said University Medical interview The never will sad the unique experience medical just turning out rare doctors whet education will have applications other There must change education and parts the country works and motivation out students schools ape toy think wall encourage them return thy welcomed nine freshman towns where mans them grow students toe medical including two from said are The taking their first semester work Nearly twice medical student the are the and other students choose Jess populated for with State practices than the national Cone Other facets the program include residency for students with practicing physicians rural expose them real town said dean the medical school and director the program One phase program already
ug135-scrapbook1-page5.jpg,No text detected
ug135-scrapbook1-page6.jpg,includes the text: oat PONS The hoe been peg the educate cram the for Pour schools tie avers tape din They this Got settle that are Stake and pes WANT tho fame fig oof few the the nite largest states end allows the Wool want don tie mole cue tala Gilt With lab Sane the yea cur tens feet tau roe teaching the home Qua university can the Court funded the The new how the end Wow start are presently VAC sett Wall the year the graduate dean's Many first year but said
ug135-scrapbook1-page7.jpg,No text detected
ug135-scrapbook1-page8.jpg,includes the text: Number Hope for relieving rural rage see helping meet the the Three year phase new ram cot Doe get tea any The plan medical takes ort tie tee ert tee Fees PUT cane thee that ties states The tide tits the Bens The the PETITE Colter During their stay the participating may spend six BET Seas weeks electives Community clinical this Time they would again actual practice medicine working with the community mes Program administrators hope Sorts that the students and would Toes become involved with the community and want establish noted the Case Students studying and ore tor most Sates Guy the would probably grate eta the peered coated Falls areas where hospitals and three number physicians PEE TEE Both students the baste Hang physicians would the tee eat its because Could more quickly gan oat cline mew fore ate ill add medical centers State taro ported the advantages entity ate the opener the Pie thee medical Medical School sate are hae the Tee Sots yes tire recto hey The toe hag cot beers reverend Pest bye eye gas behind the burned capitalizing Pore Dating WONT tee the pray ope holds toe Pert tee the additional gel areas bare the part ane the faculty and community pie tater tee the the for Varying periods tee cot this accomplished the University School other sheets the out the home institution's They feel the create COMMITMENT own residents cation
ug135-scrapbook1-page9.jpg,No text detected
ug138_1_1_035.jpg,includes the text: Entomology and Plant Quarantine Subject Office Locality Date Size Photographer Release Hold Published Plate Page Description Bind drape let wanna wanna GOVERNMENT PRINTING OFFICE OVER
